{
  "unit_id": "phys-2",
  "subject": "물리학",
  "unit_title": "Ⅱ. 전기와 자기",
  "generated_at": "2026-09-13",
  "attempt": 1,
  "source": {
    "text_jsonl": "output/source/phys-2/text.jsonl",
    "standards": ".claude/skills/curriculum-mapper/references/standards.yaml",
    "registry": "docs/concept_registry.yaml"
  },
  "candidates": [
    {
      "id": "phys-electric-charge",
      "term": "전하",
      "concept_key": "concept:electric-charge",
      "registry_status": "new",
      "pages": [
        84
      ],
      "topic_id": "phys-2-1-01",
      "section_id": "phys-2-1",
      "curriculum": [
        "12물리02-01"
      ],
      "role": "supporting",
      "difficulty": 2,
      "evidence": [
        {
          "page": 84,
          "block_id": "p84-b11",
          "hint": "전기 현상을 일으키는 물질의 속성"
        },
        {
          "page": 84,
          "block_id": "p84-b19",
          "hint": "마찰로 전자가 옮겨가 대전된다"
        }
      ],
      "relation_seeds": [
        "전하와 전기력",
        "마찰과 전자 이동, 대전",
        "중성 원자의 양·음 전하량"
      ],
      "term_en": "electric charge",
      "note": "'대전'·'대전체'는 이 카드의 관계 명제로 흡수했다."
    },
    {
      "id": "phys-electric-force",
      "term": "전기력",
      "concept_key": "concept:electric-force",
      "registry_status": "new",
      "pages": [
        84,
        85
      ],
      "topic_id": "phys-2-1-01",
      "section_id": "phys-2-1",
      "curriculum": [
        "12물리02-01"
      ],
      "role": "core",
      "difficulty": 3,
      "evidence": [
        {
          "page": 85,
          "block_id": "p85-b1",
          "hint": "대전체 사이에 상호작용하는 힘"
        },
        {
          "page": 85,
          "block_id": "p85-b2",
          "hint": "같은 전하 척력·다른 전하 인력"
        }
      ],
      "relation_seeds": [
        "전하의 종류와 힘의 방향",
        "전기력과 전하량",
        "전기력과 전하 사이 거리"
      ],
      "term_en": "electric force"
    },
    {
      "id": "phys-coulomb-law",
      "term": "쿨롱 법칙",
      "concept_key": "concept:coulomb-law",
      "registry_status": "new",
      "pages": [
        85
      ],
      "topic_id": "phys-2-1-01",
      "section_id": "phys-2-1",
      "curriculum": [
        "12물리02-01"
      ],
      "role": "supporting",
      "difficulty": 3,
      "evidence": [
        {
          "page": 85,
          "block_id": "p85-b1",
          "hint": "전하량 곱 비례·거리 제곱 반비례"
        },
        {
          "page": 85,
          "block_id": "p85-b24",
          "hint": "두 점전하에 작용하는 힘의 크기"
        }
      ],
      "relation_seeds": [
        "전하량의 곱과 전기력",
        "거리와 전기력(역제곱)",
        "쿨롱 상수"
      ],
      "term_en": "Coulomb's law",
      "note": "수식 글자열이 사설 인코딩으로 깨져 있다. 관계를 말로 세우고 식은 C7 삽화로 붙인다."
    },
    {
      "id": "phys-electric-field",
      "term": "전기장",
      "concept_key": "concept:electric-field",
      "registry_status": "new",
      "pages": [
        83,
        86
      ],
      "topic_id": "phys-2-1-01",
      "section_id": "phys-2-1",
      "curriculum": [
        "12물리02-01"
      ],
      "role": "core",
      "difficulty": 3,
      "evidence": [
        {
          "page": 86,
          "block_id": "p86-b3",
          "hint": "전하가 전기력을 미치는 공간"
        },
        {
          "page": 86,
          "block_id": "p86-b11",
          "hint": "전기장의 세기 = 전기력/전하량"
        },
        {
          "page": 86,
          "block_id": "p86-b15",
          "hint": "대전체 모양에 따른 전기장 형태"
        }
      ],
      "relation_seeds": [
        "전하와 전기장 형성",
        "전기장의 세기와 전기력",
        "대전체와의 거리와 전기장 세기",
        "중력장과의 견줌"
      ],
      "term_en": "electric field"
    },
    {
      "id": "phys-electric-potential-energy",
      "term": "전기적 위치 에너지",
      "concept_key": "concept:electric-potential-energy",
      "registry_status": "new",
      "pages": [
        87
      ],
      "topic_id": "phys-2-1-01",
      "section_id": "phys-2-1",
      "curriculum": [
        "12물리02-01"
      ],
      "role": "supporting",
      "difficulty": 3,
      "evidence": [
        {
          "page": 87,
          "block_id": "p87-b2",
          "hint": "외부가 한 일만큼 증가"
        },
        {
          "page": 87,
          "block_id": "p87-b25",
          "hint": "곁주 정의"
        }
      ],
      "relation_seeds": [
        "외부가 한 일과 전기적 위치 에너지",
        "전기력의 방향과 위치 에너지가 낮아지는 방향",
        "중력 위치 에너지와의 견줌"
      ],
      "term_en": "electric potential energy"
    },
    {
      "id": "phys-electric-potential",
      "term": "전위",
      "concept_key": "concept:electric-potential",
      "registry_status": "new",
      "pages": [
        87
      ],
      "topic_id": "phys-2-1-01",
      "section_id": "phys-2-1",
      "curriculum": [
        "12물리02-01"
      ],
      "role": "supporting",
      "difficulty": 4,
      "evidence": [
        {
          "page": 87,
          "block_id": "p87-b17",
          "hint": "단위 양전하가 갖는 전기적 위치 에너지"
        },
        {
          "page": 87,
          "block_id": "p87-b26",
          "hint": "곁주 단위 V의 뜻"
        }
      ],
      "relation_seeds": [
        "전기적 위치 에너지와 전하량",
        "전위와 전기장 안 전하의 이동"
      ],
      "term_en": "electric potential",
      "homonym_flag": true,
      "note": "★homonyms.yaml watch_terms '전위'. 물리 전기 퍼텐셜 sense(concept:electric-potential)이고 화학의 전위(dislocation)·생명과학의 막전위/활동전위와 표기만 같다. 링크는 G3 사람 게이트까지 걸지 않는다."
    },
    {
      "id": "phys-potential-difference",
      "term": "전위차",
      "concept_key": "concept:potential-difference",
      "registry_status": "new",
      "pages": [
        87,
        90
      ],
      "topic_id": "phys-2-1-01",
      "section_id": "phys-2-1",
      "curriculum": [
        "12물리02-01"
      ],
      "role": "core",
      "difficulty": 3,
      "evidence": [
        {
          "page": 87,
          "block_id": "p87-b21",
          "hint": "두 점 사이 전위의 차, 전압"
        },
        {
          "page": 90,
          "block_id": "p90-b12",
          "hint": "전위차가 클수록 센 전류"
        }
      ],
      "relation_seeds": [
        "전위차와 전류",
        "전위차와 전하가 받는 일"
      ],
      "aliases": [
        "전압"
      ],
      "term_en": "potential difference",
      "homonym_flag": true,
      "note": "표제어에 '전위'가 그대로 들어 있어 플래그를 켰다. 사람 확인 전에는 어느 sense 와도 이어지지 않는다."
    },
    {
      "id": "phys-electric-current",
      "term": "전류의 세기",
      "concept_key": "concept:electric-current",
      "registry_status": "new",
      "pages": [
        91
      ],
      "topic_id": "phys-2-1-02",
      "section_id": "phys-2-1",
      "curriculum": [
        "12물리02-02"
      ],
      "role": "supporting",
      "difficulty": 2,
      "evidence": [
        {
          "page": 91,
          "block_id": "p91-b40",
          "hint": "단위 시간 단면을 지나는 전하량"
        },
        {
          "page": 91,
          "block_id": "p91-b48",
          "hint": "1 A의 뜻"
        }
      ],
      "relation_seeds": [
        "전하량·시간과 전류의 세기",
        "전위차와 전류의 세기"
      ],
      "term_en": "electric current"
    },
    {
      "id": "phys-ohm-law",
      "term": "옴의 법칙",
      "concept_key": "concept:ohm-law",
      "registry_status": "new",
      "pages": [
        91
      ],
      "topic_id": "phys-2-1-02",
      "section_id": "phys-2-1",
      "curriculum": [
        "12물리02-02"
      ],
      "role": "supporting",
      "difficulty": 2,
      "evidence": [
        {
          "page": 91,
          "block_id": "p91-b2",
          "hint": "저항 일정할 때 전압과 전류"
        },
        {
          "page": 91,
          "block_id": "p91-b45",
          "hint": "연계 학습 상자"
        }
      ],
      "relation_seeds": [
        "전압과 전류의 비례",
        "저항과 전류의 세기"
      ],
      "term_en": "Ohm's law"
    },
    {
      "id": "phys-electric-power-consumption",
      "term": "소비 전력",
      "concept_key": "concept:electric-power-consumption",
      "registry_status": "new",
      "pages": [
        90,
        91
      ],
      "topic_id": "phys-2-1-02",
      "section_id": "phys-2-1",
      "curriculum": [
        "12물리02-02"
      ],
      "role": "core",
      "difficulty": 3,
      "evidence": [
        {
          "page": 90,
          "block_id": "p90-b10",
          "hint": "1초 동안 저항에서 소비되는 전기 에너지"
        },
        {
          "page": 91,
          "block_id": "p91-b66",
          "hint": "소비 전력의 정의식 자리"
        }
      ],
      "relation_seeds": [
        "전압·전류와 소비 전력",
        "저항과 소비 전력",
        "소비 전력과 발생하는 열"
      ],
      "term_en": "power consumption"
    },
    {
      "id": "phys-series-connection-of-resistor",
      "term": "저항의 직렬연결",
      "concept_key": "concept:series-connection-of-resistor",
      "registry_status": "new",
      "pages": [
        94
      ],
      "topic_id": "phys-2-1-02",
      "section_id": "phys-2-1",
      "curriculum": [
        "12물리02-02"
      ],
      "role": "core",
      "difficulty": 3,
      "evidence": [
        {
          "page": 94,
          "block_id": "p94-b3",
          "hint": "도선이 하나인 회로의 전체 저항"
        },
        {
          "page": 94,
          "block_id": "p94-b14",
          "hint": "각 저항에 흐르는 전류가 같다"
        },
        {
          "page": 94,
          "block_id": "p94-b23",
          "hint": "저항 수가 늘면 소비 전력 감소"
        }
      ],
      "relation_seeds": [
        "직렬연결과 전체 저항",
        "직렬연결에서 전류가 같음",
        "직렬 저항 수와 전체 소비 전력",
        "각 저항의 소비 전력비와 저항비"
      ],
      "term_en": "series connection of resistors"
    },
    {
      "id": "phys-parallel-connection-of-resistor",
      "term": "저항의 병렬연결",
      "concept_key": "concept:parallel-connection-of-resistor",
      "registry_status": "new",
      "pages": [
        95,
        96
      ],
      "topic_id": "phys-2-1-02",
      "section_id": "phys-2-1",
      "curriculum": [
        "12물리02-02"
      ],
      "role": "core",
      "difficulty": 3,
      "evidence": [
        {
          "page": 95,
          "block_id": "p95-b1",
          "hint": "전류가 두 갈래로 나뉜다"
        },
        {
          "page": 95,
          "block_id": "p95-b10",
          "hint": "각 저항에 걸리는 전압이 같다"
        },
        {
          "page": 95,